Radiology Sentence,Simplification in Stage2,Version,Stage1: You understand the meaning of the sentence.,Stage1: Can you guess the level of severity of the medical condition described in the sentence?,Stage1: Can you guess the medical urgency of the condition described in the sentence?,Stage1: Make your best guess about the severity of the described medical condition.,Stage2: You understand the meaning of the sentence.,Stage2: Can you guess the level of severity of the medical condition described in the sentence?,Stage2: Can you guess the medical urgency of the condition described in the sentence?,Stage2: Has the simplified sentence improved your understanding of the original sentence?,Stage2: Make your best guess about the severity of the described medical condition.,Stage3: Which simplifications do you like the most?,Stage3: Please provide your justification.,Stage3: Which simplifications do you like the least?,Stage3: Please provide your justification.
There are 2 hyperenhancing liver lesions.,There are two abnormal areas in the liver that need further evaluation.,Dummy_SC,Most of it,With high confidence,With high confidence,Serious,Completely,With high confidence,With high confidence,I understand much better,Moderate,CoT_SC,Simplification C provides information about what abnormal thing has happened and then provides next steps before any conclusions about the severity of the condition are made.,CoT_BS,Simplification D mentions bright spots but does not further explain what that means and would seem to cause a patient unnecessary worry due to confusion about what the bright spots are.
"Few stable less than 5 mm hypodensities, too small to characterize, probably simple cysts.","There are a few tiny spots that appear less dense than the surrounding tissues. They are too small to determine their nature, but they are likely harmless fluid-filled sacs.",CoT_BS,Most of it,With high confidence,With high confidence,Mild,Completely,With high confidence,With high confidence,I understand much better,Healthy,CoT_SC,Provides clear understanding about what the scan is showing and the most likely diagnosis for the patient to understand what was found.,Dummy_SC,Clearly states that the small spots are cysts when it cannot be completely confirmed. Could potentially be a more serious issue if left unmonitored which may happen if patient is told they are completely harmless.
Diffusely heterogeneously enhancing liver parenchyma.,The liver tissue shows uneven distribution of increased visibility/activity throughout.,CoT_BS,Some parts of it,Not at all,Not at all,Moderate,Most of it,With low confidence,With low confidence,I understand slightly better,Moderate,Dummy_SC,Provides the problem that is occurring and a potential reason for the event.,Dummy_BS,Unsure how it relates to what is happening or what the severity of the condition is.
"Focal perfusion defect posterior aspect, hepatic segment VI, likely a low grade laceration, measures approximately 1.2 cm in depth.","There is a small tear, about 1.2 centimeters deep, in a specific region at the back of the liver. This tear is causing reduced blood supply to that area, indicating a minor injury.",CoT_SC,Most of it,With low confidence,With low confidence,Moderate,Completely,With high confidence,With high confidence,I understand much better,Moderate,CoT_SC,Clearly says what is happening and provides level of severity for the patient with easy to understand language. ,Dummy_BS,Uses many terms that someone without any medical or anatomical knowledge would not understand.
"Curvilinear perfusion defect within the inferior medial, aspect of the hepatic segment V, likely sequela of prior trauma or infection.","There is a problem with blood flow in a specific area of the liver, which might be due to a past injury or infection.",Dummy_SC,Some parts of it,With low confidence,With low confidence,Mild,Completely,With low confidence,With low confidence,I understand much better,Mild,Dummy_SC,"Clearly mentions that problem is related to blood flow which would be the root problem, while the other mention a curved area which is not clear how that causes issues.",Dummy_BS,Uses too much medical language a patient may not understand.
"Secretions are seen within the trachea, bronchus intermedius, and left mainstem bronchus. There are some impacted small airways bilaterally.","There is mucus in the windpipe and some blocked smaller airways on both sides of the lungs, including a specific branch on the left side.",Dummy_SC,Some parts of it,With low confidence,With low confidence,Moderate,Completely,With high confidence,With high confidence,I understand much better,Moderate,Dummy_BS,Provides a lot of information so the patient knows exactly what is going on with simple terms.,CoT_SC,Patients may not know terminology for the different anatomical structures.
The enteric tube tip terminates within the proximal duodenum.,"The end of the tube is placed in the upper part of the small intestine, which is connected to the stomach.",Dummy_SC,Some parts of it,Not at all,Not at all,Mild,Most of it,With low confidence,With low confidence,I understand slightly better,Mild,CoT_BS;CoT_SC,Clearly explains what the use of the tube is for and where it is located.,Dummy_SC,Too simple.
The abdominal aorta is normal in course and caliber with mild aortoiliac atherosclerotic calcifications.,"The main blood vessel in the abdomen is in good shape and size, and there are some hardened cholesterol deposits in the arteries that supply blood to the pelvis and lower limbs, which is a common age-related finding.",CoT_SC,Some parts of it,With low confidence,With low confidence,Moderate,Completely,With high confidence,With high confidence,I understand much better,Mild,CoT_SC,Clearly identifies the problem and also explains that this is a common and well studied condition.,Dummy_BS,Patients may not know where the regions mentioned were located.
There is moderate body wall edema within the bilateral hip soft tissues.,The hip soft tissues have moderate body wall edema on both sides.,Dummy_BS,Most of it,With low confidence,With low confidence,Moderate,Most of it,With low confidence,With low confidence,It did not help,Moderate,Dummy_BS,Simple and to the point without extra words and still gets the points across.,CoT_SC,Cannot understand what is happening.
There is a 1.4 cm cyst at the right hepatic dome.,"There is a small fluid-filled sac, measuring 1.4 centimeters, in the upper right portion of the liver.",CoT_BS;CoT_SC,Completely,With high confidence,With high confidence,Healthy,Completely,With high confidence,With high confidence,I understand much better,Healthy,CoT_BS;CoT_SC,Explains what a cyst is and where it is located.,Dummy_BS,Not specific enough about where the cyst is located.
"Scattered densely sclerotic bone islands are seen in the pelvic, likely benign.","Scattered dense, likely benign bone islands are observed in the pelvic region.",Dummy_SC,Some parts of it,With high confidence,With high confidence,Healthy,Most of it,With high confidence,With high confidence,I understand slightly better,Healthy,CoT_BS;CoT_SC,Clearly explain the condition and whether or not concern is necessary.,Dummy_BS,Does not clearly explain the condition in simple terms.
Diffuse hepatic steatosis with some fatty sparing adjacent to the gallbladder fossa.,"The liver has fat buildup throughout it, but there are some areas near the gallbladder where less fat is present.",CoT_BS,Some parts of it,Not at all,Not at all,Mild,Completely,With low confidence,With low confidence,I understand much better,Mild,CoT_SC,Explains the conditions clearly and gives name in case patient hears it in another context and can understand.,Dummy_SC,"Too simple, paints a picture of what is happening that may not be the most accurate."
"Multiple nonobstructing left renal calculi, largest representative measuring 5 mm.","You have several small kidney stones in your left kidney, but they are not blocking anything. The biggest one is 5 mm in size.",CoT_BS;CoT_SC,Some parts of it,With low confidence,With low confidence,Mild,Completely,With high confidence,With high confidence,I understand much better,Healthy,CoT_BS;CoT_SC,Explains everything clearly and whether or not to worry about the condition,Dummy_BS,Does not mention that the kidney stones are not in the way of normal functioning.
Sigmoid colonic diverticula seen without evidence of diverticulitis.,"Small bulges in the lower part of the large intestine are present, but there are no signs of inflammation or infection.",CoT_BS,Not at all,Not at all,Not at all,Moderate,Completely,With low confidence,With low confidence,I understand much better,Moderate,CoT_SC,Explains the situation and condition very clearly with the level of severity.,Dummy_BS,Does not explain anything about the condition in simpler terms.
The psoas muscles are symmetric bilaterally.,"The psoas muscles, which are located in your lower back on each side of your spine, are the same on both sides of your body.",CoT_SC,Some parts of it,With low confidence,With low confidence,Healthy,Completely,With high confidence,With high confidence,I understand much better,Healthy,CoT_SC,Clearly identifies location of the muscles and what state they are in.,CoT_BS;Dummy_BS;Dummy_SC,Too simple does not describe location of muscles.
There are bilateral dependent hypoventilatory changes with subpleural atelectasis within the right middle and lower lobes.,"There are changes in both sides of the lungs, particularly in the lower and middle parts of the right lung. These changes are causing reduced breathing and partial collapse in areas close to the lung surface.",CoT_SC,Some parts of it,Not at all,Not at all,Moderate,Completely,With high confidence,With high confidence,I understand much better,Serious,Dummy_SC;CoT_SC,,Dummy_BS,
Multiple chronic appearing rib deformities bilaterally.,Multiple bilateral rib deformities suggestive of chronicity.,Dummy_BS,Completely,With high confidence,With high confidence,Mild,Completely,With low confidence,With low confidence,It further confused me,Mild,CoT_SC;CoT_BS;Dummy_SC,,Dummy_BS,
"Subcentimeter hypoattenuating lesions within the bilateral kidneys, which are too small to characterize.",The kidneys have very small abnormal areas that are too tiny to identify. They're present on both sides of the kidneys. Further evaluation is needed to understand what these areas might indicate.,CoT_SC,Some parts of it,With low confidence,With low confidence,Mild,Completely,With low confidence,With low confidence,I understand much better,Mild,CoT_SC,,Dummy_SC,
There is thickening of the appendix measuring 1.1 cm with appendicolith and surrounding inflammatory stranding.,The appendix is thickened at 1.1 cm with an appendicolith and inflammation around it.,Dummy_BS,Most of it,With low confidence,With low confidence,Mild,Some parts of it,With low confidence,With low confidence,It did not help,Mild,CoT_BS;CoT_SC;Dummy_SC,,Dummy_BS,
Atrophic kidneys are noted bilaterally with multiple simple cysts.,Both kidneys are shrunken and contain multiple small sacs.,Dummy_SC,Most of it,With low confidence,With low confidence,Mild,Most of it,With low confidence,With low confidence,I understand slightly better,Moderate,CoT_BS;CoT_SC,,Dummy_SC;Dummy_BS,
"Nodular hepatic surface contour reflecting, changes of cirrhosis.",The liver surface shows nodular contours due to cirrhosis.,Dummy_BS,Some parts of it,Not at all,Not at all,Moderate,Some parts of it,Not at all,Not at all,It did not help,Moderate,CoT_SC;Dummy_SC,,Dummy_BS,
Partially visualized central pulmonary arteries are not dilated.,The part of the blood vessels that can be seen in the lungs is not enlarged.,CoT_BS,Most of it,With low confidence,With low confidence,Mild,Most of it,With low confidence,With low confidence,I understand slightly better,Mild,CoT_SC,,Dummy_BS,
There is mild pancreatic parenchymal atrophy without main duct dilation.,The pancreas has a small amount of tissue shrinkage but no major blockages.,CoT_BS,Some parts of it,Not at all,Not at all,Moderate,Completely,With low confidence,With low confidence,I understand much better,Mild,CoT_BS;CoT_SC,,Dummy_SC,
There is no intrahepatic or extra-hepatic biliary ductal dilatation.,No biliary ductal dilatation is present within or outside the liver.,Dummy_BS,Some parts of it,Not at all,Not at all,Mild,Some parts of it,Not at all,Not at all,It did not help,Mild,CoT_SC,,Dummy_BS,
Diastases rectus with a small fat-containing umbilical hernia.,"The muscles in the middle of the abdomen are separated, and there is a small bulge around the belly button that contains some fat.",Dummy_SC,Some parts of it,Not at all,Not at all,Mild,Completely,With low confidence,With low confidence,I understand much better,Moderate,CoT_SC,,Dummy_BS,
The osseous structures are diffusely demineralized.,The bone structures are extensively weakened.,Dummy_BS,Some parts of it,Not at all,Not at all,Moderate,Completely,With high confidence,With high confidence,I understand much better,Serious,CoT_SC,,Dummy_SC,
Mosaic perfusion at the lung bases with scattered areas of linear atelectasis.,The lung bases show mosaic perfusion with scattered linear atelectasis.,Dummy_BS,Not at all,Not at all,Not at all,Moderate,Not at all,Not at all,Not at all,It did not help,Moderate,CoT_SC;Dummy_SC,,CoT_BS,
The pancreas is homogeneous in appearance without focal mass or main duct dilatation.,"The pancreas looks normal and doesn't have any lumps, bumps, or blockages in its tubes.",CoT_BS,Completely,With high confidence,With high confidence,Healthy,Completely,With high confidence,With high confidence,I understand slightly better,Healthy,CoT_SC;CoT_BS,,Dummy_BS,
No discrete space-occupying lesions or acute abnormality appreciated in the liver.,"The liver appears normal with no visible abnormal growths, masses, or recent changes.",CoT_SC,Some parts of it,With low confidence,With low confidence,Healthy,Completely,With high confidence,With high confidence,I understand much better,Healthy,CoT_SC;CoT_BS,,Dummy_SC,
There are metastatic bony lesions throughout the thorax.,The bones in the chest show widespread cancer spread.,Dummy_SC,Completely,With high confidence,With high confidence,Serious,Completely,With high confidence,With high confidence,I understand slightly better,Serious,CoT_BS;CoT_SC,,Dummy_BS,
Myomatous uterus.,Uterus with myomas.,Dummy_BS,Some parts of it,Not at all,Not at all,Mild,Some parts of it,Not at all,Not at all,It did not help,Mild,CoT_BS;CoT_SC,,Dummy_BS,
Status post hysterectomy.,"After having a hysterectomy, which is a surgery to remove the uterus, the person is in the recovery phase.",CoT_BS,Completely,With high confidence,With high confidence,Mild,Completely,With high confidence,With high confidence,I understand slightly better,Moderate,CoT_BS,,Dummy_BS,
There is grade 1 anterolisthesis of L4 on L5.,The diagnosis indicates a mild condition where the fourth bone in the lower part of the spine is slipping slightly forward over the fifth bone. This finding suggests a relatively low level of severity.,CoT_SC,Most of it,With low confidence,With low confidence,Moderate,Completely,With high confidence,With high confidence,I understand much better,Mild,CoT_SC;Dummy_SC,,CoT_BS,
There is an angiomyolipoma measuring 2 cm along the left renal upper pole.,The left renal upper pole has a 2 cm angiomyolipoma.,Dummy_BS,Some parts of it,Not at all,Not at all,Moderate,Some parts of it,Not at all,Not at all,It did not help,Moderate,CoT_SC,,Dummy_BS,
There are air-fluid levels in dilated loops of small bowel.,"The small intestines appear enlarged, and there are levels of air and fluid present.",Dummy_SC,Some parts of it,With low confidence,With low confidence,Moderate,Completely,With low confidence,With low confidence,I understand much better,Moderate,CoT_SC,,Dummy_BS,
There are enlarged celiac and retroperitoneal lymph nodes.,"The lymph nodes near the stomach and behind the abdominal cavity are larger than usual. This could be a sign of different conditions like infection, inflammation, or other possible health issues.",CoT_SC,Some parts of it,With low confidence,With low confidence,Mild,Completely,With high confidence,With high confidence,I understand much better,Mild,CoT_SC,,Dummy_BS,
Diffuse decreased attenuation which can be seen with fatty infiltration.,The scattered distribution of fat cells can be seen as a decrease in the strength of X-ray signals.,CoT_BS,Not at all,Not at all,Not at all,Mild,Most of it,With low confidence,With low confidence,I understand slightly better,Mild,CoT_BS,,Dummy_BS,
There is a moderate sized left fat-containing inguinal hernia.,"There is a moderate-sized hernia on the left side of the body, near the groin area, which contains some fat.",CoT_BS;CoT_SC,Most of it,With low confidence,With low confidence,Mild,Most of it,With low confidence,With low confidence,I understand slightly better,Mild,CoT_BS;CoT_SC,,Dummy_BS,
Small calcified granulomata in the left hepatic lobe.,There are small masses of hardened immune cells with calcium deposits in the left part of the liver. This can happen as a response to previous infections or inflammation.,CoT_SC,Most of it,With low confidence,With low confidence,Moderate,Completely,With low confidence,With low confidence,I understand much better,Moderate,CoT_SC;Dummy_SC,,Dummy_BS,
Diffuse hepatic steatosis.,Extensive accumulation of fat in the liver.,Dummy_SC,Some parts of it,Not at all,Not at all,Mild,Completely,With low confidence,With low confidence,I understand much better,Moderate,CoT_SC,,Dummy_BS,